{
  "timestamp": "2026-06-21T12:00:00Z",
  "source_path": "evidence/ci/cat_ci_report_MP_CAT_A011_4C01.json",
  "destination_path": "evidence/archive/2026/Q2/cat_ci_report_MP_CAT_A011_4C01.json",
  "file_size_bytes": 45000,
  "event": "archived",
  "eligibility": "eligible",
  "age_days": 94,
  "git_commit_sha": "abc123def456",
  "archival_batch_id": "batch_2026_06_21_001"
}
